"102","https://placeimg.com/938/506/any","Network pull organization serious","News film building finish relate eight receive environment land trouble staff follow baby job game according board whole","938.09","21","Black cultural pull above us adult see body program"
"103","https://dummyimage.com/617x540","Matter door tax","Owner traditional fill address teach simply wait similar blood really child lead sport everything true water short report necessary lawyer else behind","901.55","11","Appear economy whom forward arm prove community expect live"
"104","https://placeimg.com/714/40/any","Mean five establish per floor world","Community together far enough ability citizen girl do them answer knowledge her ten structure foot question learn economic recent let receive scene no enough case action institution","866.84","49","Expect attention loss full free another mind kind religious"
"105","https://placekitten.com/499/61","Five modern there resource box","Sometimes drive manage management conference energy although well far summer game ever hospital arrive third","892.44","6","You out thus close among"
"106","https://placekitten.com/38/756","Various watch choice cause natural imagine","Single share down try happen show garden worry put he ask could water offer son defense modern outside voice measure","147.21","20","Old personal benefit close eight energy continue industry best"
"107","https://placekitten.com/165/766","Else social from","Thank goal chance whom current old yeah interview somebody reflect she half air important truth speak behind appear","509.99","18","Ready issue that party identify wall subject management interesting"
"108","https://placeimg.com/920/325/any","Upon article compare television fly","Responsibility eight west leader side look give sense fine street make case debate administration expert it run","9.76","14","Hit team reveal player soon current by write north"
"109","https://placekitten.com/811/867","Guess them purpose partner son air","Something face material however you drop success space water realize market walk also traditional score dark factor tell billion","355.27","10","Senior film clearly decide officer"
"110","https://www.lorempixel.com/580/380","Art call various offer","Of structure blue end require night personal sure whether visit speak ahead rock parent some three onto director interesting","876.06","5","Worry economic shoulder gas right yes American call statement"
"111","https://www.lorempixel.com/817/227","Head friend or","Network deep politics I American tonight try PM debate in reason break debate bed value sense case dog price wind democratic summer itself tax activity mission industry","283.05","32","Speech pattern surface play four"
"112","https://placeimg.com/221/543/any","Meeting material deep anything","Site beyond former perform whose better themselves field number benefit lose trade different draw","52.89","45","Approach live necessary interesting easy perhaps best company far"
"113","https://dummyimage.com/927x327","Late walk live skill course","Identify involve hospital capital others majority something part generation teacher everybody figure thank woman deep different often agency spring interview room agent some nature against answer","534.47","39","Laugh popular too high inside somebody"
"114","https://www.lorempixel.com/242/28","Son and give","Senior alone option in evidence board business choice dream low painting employee daughter miss maintain avoid direction hour various leader east them your choice their make","336.97","38","Near need recently hospital red"
"115","https://dummyimage.com/861x680","Speak answer fill on program others","Federal movement down under white field television its factor herself sea worker store","126.12","19","Crime drug wall clearly defense soldier"
"116","https://www.lorempixel.com/975/901","Ever voice hotel at","Police space specific enter hope current page skill indeed four interview return American under product occur","19.58","5","Character pattern next clearly"
"117","https://dummyimage.com/152x551","Interesting measure value two east","Cover care time agree everybody rock after level pattern side collection cold team miss great without finish weight theory result discussion would arrive teacher where close democratic","145.17","34","Behind design show support summer type focus discuss"
"118","https://placeimg.com/379/220/any","Arrive whatever wrong to thought whatever","Long economic tough also money system involve require region sign rule feel","698.23","37","Area agency shoulder protect"
"119","https://dummyimage.com/677x766","Speech lawyer west particularly everything","Poor Mr statement best child full describe economy goal government medical science mind","83.78","42","Product usually office represent least available between"
"120","https://placeimg.com/69/704/any","Structure chair same impact no","Executive base play kitchen try trial other night somebody process analysis detail scene pick impact network alone culture exist","271.03","16","Message reason expect capital"
"121","https://www.lorempixel.com/876/893","Person strategy large about","Put happen discover she shoulder matter not rich foreign professor will themselves heart forget crime resource","310.97","36","Nothing sit six day claim contain discuss bad discussion"
"122","https://dummyimage.com/631x91","Institution seek certainly explain space","Main both purpose ready become leader difference ok some group leave course eye between able tax owner the manager","641.58","35","Mind walk child above lawyer teacher personal"
"123","https://placeimg.com/395/1002/any","Well condition not who future","Citizen without Mrs such job single ability wide attention fact level never view","812.75","4","Decision TV industry goal position sing"
"124","https://dummyimage.com/585x166","Thousand ask possible decide career professor","Their once should real Mrs lay new everyone accept politics too goal","574.07","3","Another institution whose before"
"125","https://www.lorempixel.com/96/137","Like decide environment adult listen","Wear just writer citizen sport dream despite much adult soon major charge author themselves other today PM western","527.36","49","Six manager son beyond change have"
"126","https://dummyimage.com/432x612","Pick suggest woman suggest question","Continue attack expect theory meet morning book whatever building whole control any wait all evening process","751.65","46","Door admit visit against some foreign piece"
"127","https://dummyimage.com/218x866","Expect level window","Even side over role score throw name have TV environment hand artist fact year gun test according majority","290.01","13","Interest move authority compare"
"128","https://placeimg.com/731/440/any","Do network expert relationship seven her","North while measure trial whose thus goal test finish responsibility recent own tonight some spend interest though role firm instead dream surface health heart hold nice example","911.04","42","Society attention heavy debate cover"
"129","https://dummyimage.com/95x747","Space what practice town billion","Group indeed feel should whose into color later case less important word good business us region","913.5","22","Professor business true guy answer recognize their"
"130","https://placekitten.com/405/729","Them particularly admit live down daughter","Father evidence question fund arrive clearly bad project turn time certainly lay","704.52","42","Add age letter religious week money purpose"
"131","https://www.lorempixel.com/791/11","Between camera live note fight","Describe coach concern worker laugh action short us likely machine environmental pressure treatment law past name plan set offer present pretty language they environment different some","62.19","2","Him dog onto movement we window single"
"132","https://placekitten.com/894/216","Reality size move red","Describe pattern hard however sign put take space majority bit instead smile happen successful human stand service public according understand happen","122.2","20","Heart two data interesting"
"133","https://www.lorempixel.com/858/651","Various picture rule poor","Debate fear degree use day dog receive wife point fall spring choose","851.69","33","According capital political at film kitchen environment method"
"134","https://placekitten.com/662/826","Wrong pick structure wrong figure continue","Late surface concern law enough information which join article throughout tax gas any manager political keep attack behavior security movement","852.47","18","Job game pressure lawyer born quickly wind include allow"
"135","https://www.lorempixel.com/871/451","Goal according similar age option war","Method movie painting then rate measure brother approach five anything rate significant meet adult prepare son particular economy evening","963.75","34","Family east within walk school word"
"136","https://dummyimage.com/128x787","Stage could number for","Stock page strong term main feeling bag season short research despite approach beautiful late find heavy development","734.22","23","Under body phone would hard movement similar certainly"
"137","https://dummyimage.com/279x155","Particular only his go entire change","Election reality population pressure under rock next week scientist recognize so relationship risk agent","266.53","34","Again professor operation next black bag wrong"
"138","https://placekitten.com/587/960","Mother possible management common popular","Strong reveal future girl character event artist later someone management pressure feeling member civil","93.26","43","Upon rather claim also space good"
"139","https://placekitten.com/182/957","Into dinner both in sea","Game look probably public soon rest term tree pass he training one","238.98","50","Production consider state difference stock phone"
"140","https://placeimg.com/647/881/any","Star head full thing daughter indicate","Course lose since amount suggest city clear deep scientist rather summer country toward claim civil inside friend service push arrive body modern bit no","943.05","5","Bad wall conference view oil tree certainly would family"
"141","https://dummyimage.com/674x409","North development everything candidate rule manager","Seat true listen art consider social example state into change treatment figure program after last","573.96","42","Debate ready avoid government interview pass adult allow"
"142","https://placekitten.com/916/15","Or like crime","Among direction yard trouble smile media send water happen debate view country adult represent any despite government reveal","702.53","25","Physical sound just learn then onto"
"143","https://dummyimage.com/887x621","Nature realize southern street contain relate","Wait rate type police finally site tend staff name material standard religious base service stand","663.01","15","Capital culture their perhaps bill gun"
"144","https://dummyimage.com/799x754","Concern important son participant tree remember","Unit difficult matter police anyone including painting subject among fly firm clear foot yard make available size","800.59","49","War film Mr different admit break Republican"
"145","https://www.lorempixel.com/186/31","Face fight face region go","This want change area either role type start wonder space particular skin pick fine page smile less mother purpose part maintain study face","802.9","1","Green stock color couple apply ahead"
"146","https://www.lorempixel.com/527/507","Name suddenly charge world reveal stand","Partner seek up chance difference party spring father hospital recent back live environmental","44.98","23","Fear thus north do film modern write event help"
"147","https://placekitten.com/359/427","Record indicate wish","Practice yes kind kid peace sing decision my support behind describe local unit send strategy against value quickly record doctor network","852.6","20","Believe lot result level wind finally pretty well"
"148","https://dummyimage.com/492x511","He listen professor difficult player last","Exist history whole generation option lead increase discuss health stop law you","432.65","16","Candidate relationship already crime factor down learn weight main"
"149","https://placekitten.com/366/763","That figure bit data guy","Finally tell method together purpose either hold base arm upon one start direction night much camera spend","378.67","42","Civil main also prevent other"
"150","https://dummyimage.com/732x245","Technology there question visit","Child evidence local land cover deal left skill clear development involve everyone design possible left car it","589.41","26","Throw anything notice season probably office"
"151","https://dummyimage.com/31x516","Include our company","Stand evening whom remain suggest bill imagine former day TV situation clearly owner","505.29","20","Movement say spend best sing laugh such carry"
"152","https://www.lorempixel.com/840/686","World eat matter shoulder","Manage born carry eight think sort dream glass raise develop west dog animal suddenly property name student company light data language","504.71","44","Vote building road social perform run"
"153","https://dummyimage.com/120x941","Beat she popular difficult mouth","Section can draw culture all glass loss when forget from be player thought ready majority peace fish go issue yet build administration mouth happen thousand","33.04","5","Billion film himself street local shake dog recognize wish"
"154","https://placekitten.com/275/107","Small force bank worker finish","Similar third over sometimes street pressure son time Democrat deal pattern thing stage stage choice enough very right right such quickly fall third former watch positive crime","23.8","50","Certain available car more low one knowledge"
"155","https://placeimg.com/486/936/any","Much practice talk beat support","Wind news analysis throughout every husband certain yet politics toward people tell them whatever service well project science understand wall without about once whether power court","202.68","13","Imagine treatment bank operation fire some but"
"156","https://placekitten.com/347/220","Appear yet family represent soon","Expect law international couple word during but city operation might there reason training several research water behind lose deal foreign anything","661.99","33","Sound employee international scene hotel above"
"157","https://www.lorempixel.com/1013/628","Yourself until federal part","Management campaign produce decision dinner physical development Republican mean item sound left","945.84","30","Whom occur industry data strong relationship hand coach skin"
"158","https://placekitten.com/436/264","Newspaper thought must","Can former anyone pressure most book another chair team white figure kid course risk","668.38","35","Southern close of enough"
"159","https://www.lorempixel.com/805/645","Thing owner where treat","Budget certain choose own father budget election magazine south development this painting job lay whose despite","713.06","26","Industry customer score sport prepare"
"160","https://dummyimage.com/731x411","Drug probably same matter attention response","Job animal right man their event whose white him child by attention among than hair level job soon husband ground","890.51","32","Woman price yet outside now store over"
"161","https://dummyimage.com/828x527","Player expert player","Ball financial field its able daughter take social actually parent middle best score gun him hand part street successful fine today around performance red what individual","544.45","21","Detail free remember hard fine base garden soon stop"
"162","https://placekitten.com/214/470","Pm think include how","Personal can expect catch everybody act gun voice personal we later arrive child maintain direction before enjoy life inside see wait myself before","154.88","8","Evening suddenly option teach tax year you"
"163","https://placekitten.com/674/357","Increase they hear truth thing store","Better single hundred let believe attorney success next close country growth entire carry account western know product","742.28","19","Three forget prevent address father ago kitchen tax throw"
"164","https://www.lorempixel.com/979/914","Should along public join every option","Recently increase music many later nothing finally boy while tough reach kid three let poor understand condition she value in night","434.79","10","Church lose college half lay week charge"
"165","https://dummyimage.com/561x356","Thank boy find","Line news especially since hundred born have need eye bag recent eye again space body friend central world bill social sure light","403.73","47","Investment short else instead specific"
"166","https://dummyimage.com/931x587","Officer lot draw pick","Nor can wall two everybody first above yet officer fish you entire prepare into","158.47","10","Range crime our week still true"
"167","https://placekitten.com/1014/187","Crime behind reach","Mean respond place civil significant together maybe reason ok coach his who approach share peace notice manage","197.67","26","Story middle weight total baby off store firm perform"
"168","https://placeimg.com/829/834/any","In step guess pattern production face","Region different leave act range live along front sit your work plant off to several test morning article attack fast continue event during because","749.76","12","Field eight member want"
"169","https://www.lorempixel.com/268/719","Say project base","Skin director sister view the mission teach meet themselves leader hear cause figure though program arrive idea","566.96","29","Call seem history nice about easy often all capital"
"170","https://dummyimage.com/837x407","Black reflect win while home deal","Likely improve good save return father they hear very during current price trouble if example treatment together","221.96","2","Professor together painting value alone could maintain"
"171","https://dummyimage.com/943x867","Relationship no decade","Campaign Congress push modern young century again always car strategy television put him local sing money buy leg still fire take machine them career realize","807.91","22","Force art culture protect run a wall significant"
"172","https://placeimg.com/393/472/any","Break doctor song new","Machine strong just ability dinner participant cold machine our hospital agreement artist special","649.85","38","Authority hotel ever seek plan"
"173","https://placekitten.com/200/697","Sing live name sound still for","Establish process almost give line go trade control should two meet other","217.24","17","Story case establish cost buy develop bar last"
"174","https://www.lorempixel.com/527/383","Practice century go east trip","Employee grow ok physical who establish husband heavy stuff cover training product majority rest culture analysis tend ground them perhaps old third fight","503.27","15","Size try nearly community"
"175","https://placekitten.com/710/223","Third fight project affect unit","Statement religious force us development section medical effect mention fire minute decade enough each technology hot tax her fly professional","531.27","18","Positive record wide suddenly game least"
"176","https://dummyimage.com/170x524","Throughout much nation","Brother foot administration meet a growth bill during professional enough accept stay much think environmental floor","41.42","32","Ability officer drive rather understand machine theory history design"
"177","https://www.lorempixel.com/271/879","Service ask behavior financial front","Defense company cover customer movement team moment price site wrong ever walk crime cover","104.49","13","Reduce recent look audience generation set onto figure common"
"178","https://placeimg.com/707/463/any","Adult possible six life","Other set meet civil avoid material line other effort school about television power enough American","788.5","41","Some stay TV sure"
"179","https://placekitten.com/532/705","Third three sister cut product have","Forget building ground establish go with teacher once style measure use education too nor book","621.22","5","Ten effort kitchen into data miss lawyer"
"180","https://dummyimage.com/67x430","Red list newspaper up year particular","Relate fire marriage performance idea opportunity fish civil point clear collection sure simple","131.91","38","Statement stay performance Mrs particular fly oil"
"181","https://placeimg.com/653/790/any","Know board stuff factor kind probably","Take call machine computer Democrat common both piece region give size offer consumer positive","581.04","14","News like today wait work more"
"182","https://www.lorempixel.com/514/978","Matter some man interview","Street line loss morning pretty live whether every also will because could event subject first pretty suffer myself direction message age hand conference I art","879.3","44","Southern other but certainly worker receive production"
"183","https://placeimg.com/351/832/any","Light result nothing college thought time","Soldier suddenly myself imagine kitchen bag read himself agent reason she determine action who special factor spend take would wind","675.73","21","Them skill middle theory ok exactly wish"
"184","https://placekitten.com/683/156","Someone west their","General personal town early accept nation into however his put money kind quickly grow make","439.66","33","Town big person conference type start if"
"185","https://placeimg.com/936/595/any","Arm participant government","Since present guy community already leader it hard according east threat year day society him film ahead skin past head","601.53","11","Toward fast spring produce general parent heart over situation"
"186","https://dummyimage.com/1004x690","Information since both very along son","Security window send the live economic body change even site campaign your among now offer maybe coach let summer either hard figure hope partner mission whatever","615.92","47","Eat indicate part language travel option"
"187","https://dummyimage.com/943x292","Reach risk painting camera film","Be cause bring growth mention local official worry understand contain put information cut act place go produce five forget","843.7","12","Name among hold official"
"188","https://dummyimage.com/387x844","Call newspaper get newspaper","Send affect economy be later everybody think American several theory people culture ability beat still politics town recent blue politics firm phone conference","309.56","45","Modern owner it message meeting free even high"
"189","https://placekitten.com/165/705","Not prepare important","Science though another consumer better grow story alone forward wait occur first test senior area third truth matter physical identify garden piece sign large myself","179.96","26","All TV imagine common level let great"
"190","https://placeimg.com/183/364/any","War actually official significant name east","Drive sit feeling pass party above soldier around through realize season small long create chair they always clearly young against wish where Mrs","7.03","12","Sister what religious southern size run reason"
"191","https://dummyimage.com/45x899","Represent mission even","Technology avoid less food study hit brother reach consider treat road science find west include environment president station visit indeed school because until across","710.75","30","Rock notice play green understand media"
"192","https://placeimg.com/519/882/any","Agree guy star film","Example agency career marriage no need professional today matter partner necessary that adult reveal beyond such offer much charge","746.16","42","Size center pretty else pass tonight"
"193","https://placekitten.com/81/278","Learn exactly reach difficult represent deal","Growth enough walk despite specific adult owner avoid especially writer air her key hear remember similar rise employee music suggest fund fact safe about response heart spring","782.06","31","Reflect new choose adult opportunity style yes cause"
"194","https://dummyimage.com/125x295","Few let reveal difficult","Good toward street process work low plan education which important visit article audience story debate provide with style kind win safe question week along change determine send","60.93","4","Agreement able nation foot assume and like audience"
"195","https://dummyimage.com/993x365","Smile serious final develop","Will your approach subject possible first Mr another travel administration continue author major six your may arrive kind by us","58.35","10","Three throughout believe project resource floor mouth possible"
"196","https://placekitten.com/369/590","Service drive attack safe low","Energy defense tax discuss according structure follow attention act hand process anyone nor even common over next education because some son yeah whole more understand as girl","812.48","16","Involve large important word effect six"
"197","https://placekitten.com/858/38","Trip then music","Hundred rise reality moment feel recently similar quickly trouble air easy dark deal among position onto","244.44","22","Myself industry billion various themselves character international account western"
"198","https://placeimg.com/804/971/any","Long account entire moment natural computer","Development low operation training issue far job edge majority behind record above environmental model politics yet yes","942.46","3","Number moment against purpose market east movie"
"199","https://placekitten.com/178/36","People remember development true market everybody","Support black mother section officer discover make include brother government wrong another child surface","144.22","50","Machine company many agency show cover form"
