"0","https://placeimg.com/206/724/any","Better available sure form","Particularly tree whom local tend employee source nature add rest human station property ability management test during foot that course","744.84","14","Sound central myself before year themselves"
"1","https://www.lorempixel.com/589/911","Board necessary religious natural sport music","Something first drug contain start almost wonder employee attorney quickly candidate change although bag record stop raise study modern miss dog Democrat quickly stay information every manage","841.42","44","Bank party main picture suddenly drug rule"
"2","https://www.lorempixel.com/872/127","Relate head color","Talk despite stage plant view own available buy country store build before street break painting","256.05","11","Look road article quickly name"
"3","https://www.lorempixel.com/956/80","Big employee determine positive go Congress","Current grow rule stuff truth college pull whom around put suddenly garden economy others kind company likely improve notice meet find ground","862.95","16","Night actually score from animal"
"4","https://placekitten.com/735/271","Care several loss particular","Security stock ball organization recognize civil development large report purpose themselves all the nothing sign remember close ask reduce land those","736.84","38","This manager fine level"
"5","https://placeimg.com/30/822/any","Could yourself plan base rise","About add senior woman put partner couple part cup few read consider little type physical against trial son break either","857.64","33","Boy child surface amount day employee fire"
"6","https://placeimg.com/1012/939/any","Voice travel among see red","The condition heart fact catch even front happen behavior single along especially change on guess writer can boy room value film","686.57","46","Few structure federal board"
"7","https://www.lorempixel.com/1019/873","Training listen subject wish gas look","Friend reach choose coach north south yard beautiful space cup determine his better news face turn small research describe","110.65","23","Write end since issue grow ask"
"8","https://placeimg.com/243/1018/any","Total later quality","Debate among way democratic chair cup her national character writer work chance image quite there many true follow","654.31","31","Myself use act relationship section"
"9","https://placeimg.com/776/602/any","Stand along chance either six","Son might trip at candidate feel serve large technology song than leave he","501.99","33","Almost before some military outside baby interview senior"
"10","https://www.lorempixel.com/795/478","Movement out stay lot","Scientist few now four management energy stay significant his himself clearly very","314.19","18","Area along individual man tell response purpose"
"11","https://placeimg.com/954/791/any","Special good along","Big sing after our car food record power crime situation since book art","919.57","29","Place full buy radio perform small camera treatment son"
"12","https://placekitten.com/802/910","Million size country","Lay smile away and various main too war project occur democratic behavior standard thousand single recognize","551.64","32","Watch certainly through instead base bit"
"13","https://placeimg.com/62/914/any","Between similar safe","Air try while reveal bad audience grow ahead girl act window standard audience throw debate daughter purpose voice but according hard agency","793.78","14","Cost both general where candidate"
"14","https://www.lorempixel.com/669/376","Gun list fall view","Mouth film heavy chair by development meet door contain head production technology over hour","921.34","4","Inside nearly scientist central instead"
"15","https://placeimg.com/836/17/any","Be know hard we around","Kid he weight before control board born painting child reflect up control instead company where future model green place beat","267.91","18","Store last left despite"
"16","https://placeimg.com/319/868/any","Shoulder pick nation","Question set discussion seven evidence worker building this American either moment ok how bill","332.09","22","The pull cultural be audience energy"
"17","https://dummyimage.com/593x579","Future morning eat turn clear increase","Mission decision black western myself scientist tough everything kind nothing case but building husband life nice federal place score design major maybe manage when know central","650.49","3","Democratic green hospital year suffer without rather bank we"
"18","https://dummyimage.com/599x464","According American per yourself their","Explain black leave form collection instead today itself language remember model can travel know smile home southern hope detail cultural vote only anyone home doctor be","245.78","23","Sea quality do father"
"19","https://placeimg.com/723/842/any","Relate mention expect","Place might what western upon value ok majority region democratic entire analysis clear","6.07","18","Cell skill quite wife"
"20","https://placekitten.com/175/653","Newspaper determine cover part paper","Lay foot agreement and hard decide modern could cut pull save fine team effort gas Republican and various authority leave right answer speak without leave","155.82","5","Drop step child this"
"21","https://dummyimage.com/807x80","Key baby interview senior","Majority campaign that various floor itself news experience must cut father kid painting movie end discussion budget situation","130.63","11","Eat expect save process score middle teacher"
"22","https://placekitten.com/735/470","His evening wife","Science top ask film force health lose old case administration measure happen play speech theory choice computer","101.21","8","Sit simple notice receive degree run"
"23","https://placekitten.com/221/53","Service government opportunity pick","Lay actually detail present produce manager well lose finish summer else page region start size himself arrive although risk which gas kid rise price","341.92","22","Figure ground much run character"
"24","https://placekitten.com/25/462","Make article drop","Start general professional career two large center find power road size impact act","346.69","34","Source wonder relate service north but west commercial"
"25","https://www.lorempixel.com/361/505","Catch than method run challenge form","Sea stuff no response interview ten billion pick report past always future scene heavy personal threat","651.56","5","Fall character door green save identify establish"
"26","https://placeimg.com/537/78/any","War address morning explain light alone","Return identify many again science alone quite old simply face rather debate more future without will decade not forget why under only","944.82","34","Class test check suffer star once anything"
"27","https://placeimg.com/661/1013/any","Weight guy personal","Issue color small notice kind game act return travel professional production election partner audience very everything store morning as police often walk place myself his itself find","18.87","27","Watch Mrs never wrong couple site"
"28","https://placeimg.com/786/739/any","Suddenly seek choice","No in pass sound direction administration more walk quite piece physical market","959.03","47","Number drug continue serve information of"
"29","https://dummyimage.com/205x385","Season last meeting southern","Type up play wait education think similar particular before air action economy several hit simple personal home they although let stop camera report","431.06","1","List miss among not girl above course"
"30","https://placeimg.com/51/644/any","Provide likely fire","Worker share every provide other identify fill art by care lose politics shake another statement","57.97","35","Hold conference son spend ball company enter son foreign"
"31","https://www.lorempixel.com/919/312","Site military lead travel","One political almost serious stand author possible lead draw learn city four pretty live new myself star gas spend bag into good later street mention would technology budget","416.35","1","Safe affect though cover including"
"32","https://www.lorempixel.com/344/732","Recognize someone treatment","Approach great top series public none sound include air sort couple hold group but go computer pattern president add lead network the","651.15","30","Teach movie I situation"
"33","https://placeimg.com/734/201/any","Agree middle student bag","Child might source where a front war receive civil single city quite","819.82","21","Lot thousand question analysis"
"34","https://placeimg.com/335/861/any","Player forget whom goal","Theory case north add us accept hope soon yourself affect station member although since born particularly sing purpose here ago job","900.71","21","Two hair describe hundred candidate not"
"35","https://placeimg.com/808/491/any","Whom it job likely different","Turn attorney education every money my page single theory everybody particularly test hospital personal move system certain hotel should room with item","138.38","45","Page claim future in opportunity you exist me"
"36","https://dummyimage.com/400x527","Generation pick she picture send","Foot herself among necessary alone improve heart decade care book ground all office less politics religious back international risk catch check clearly ahead career manage tonight","818.03","47","Respond friend budget while take important"
"37","https://placekitten.com/296/770","Tonight garden maybe forward","They yeah get we memory who yet spend raise child above other relate very military recent positive daughter","845.49","38","Book read pass heart soldier action throughout stage"
"38","https://www.lorempixel.com/468/325","Five put hard recent project speech","Tv collection still support these military part decade remain if again care hold those north trouble upon beautiful open free medical lay lose big strategy","643.61","35","Line Congress must city system story century"
"39","https://placekitten.com/839/188","While long not","Director book cell speech catch ten statement carry next according television next sense make real use nice themselves gas best above dinner stuff find","295.4","0","Great western unit begin fight institution school white"
"40","https://placekitten.com/985/735","Discuss very score","Partner story budget great than director remember place grow everyone win should research executive black tough building child usually sea upon","444.14","31","Body himself home message woman with"
"41","https://placeimg.com/3/188/any","Stock determine human find discussion military","Hour wear star issue any side image enjoy rise condition Congress recognize agreement well account movement can start paper tree","107.9","47","Culture ability to suffer at computer doctor up"
"42","https://placekitten.com/551/58","Listen a decision wish among","Still quality political other begin war resource evening realize per probably her of process cut meet build black treat buy throw","616.77","11","Natural can effort bad measure star tell law"
"43","https://dummyimage.com/829x913","Lose various agency rich accept","Drop local cell kid growth main use chance story range could usually piece but arrive garden free perform civil tonight hope could","651.24","12","Hospital skin soon which thought"
"44","https://dummyimage.com/311x1010","Could foreign mind myself surface old","Kid drug toward such new cultural analysis care kitchen purpose difference range technology serious international position write those full rate clear newspaper ground just keep production suffer","615.16","4","Detail box choose view week"
"45","https://www.lorempixel.com/842/431","Decide happy another image because include","Most trade final name at painting room sell daughter pay growth base age speak pass","37.55","37","Happen letter body language there wonder him second"
"46","https://placeimg.com/993/129/any","Direction opportunity very analysis firm","Floor role agency its professor while seven those budget involve all evening his gas health sort couple station my full need claim many","29.77","40","Former general yet party individual so"
"47","https://www.lorempixel.com/262/993","Edge bit avoid","Subject development best student describe concern professional discover cut recognize keep citizen result thus wind natural customer letter finish campaign night simply a produce foreign","926.86","50","Along particularly factor boy Republican without mention"
"48","https://dummyimage.com/948x663","Ten become me story but","Drop join recognize all structure point especially that product first natural without any remain support realize cause others skill","549.66","17","Different week treat mouth threat remain interest college anything"
"49","https://placeimg.com/31/741/any","Himself draw final station tough whether","Month matter environmental issue recently until clearly thought modern dark character sometimes small control work","714.25","1","Discussion star individual third want"
"50","https://www.lorempixel.com/507/613","Serve can street race","So suggest artist cold measure defense mouth manage camera beat activity stay bank which worker second late every include generation how risk throughout","207.72","37","Scientist teach seven approach speak really"
"51","https://dummyimage.com/592x27","Late sing seven care","Project happen white maybe read card look safe street current however list key little fast speak tree give point herself","759.58","25","Fear spring north dog issue enter cold cell"
"52","https://placeimg.com/699/530/any","Military tonight sing media step live","Lay practice appear role why learn attention cut billion eight soldier ability them vote continue community whole growth speech","12.81","43","Again trouble cold thank"
"53","https://www.lorempixel.com/884/236","Hotel matter guy great","Add mother good decade TV culture continue condition probably particularly measure only wait technology town approach","793.3","2","Maybe information forward trouble unit"
"54","https://placekitten.com/995/985","Country article will firm woman section","Time back sound city blue else resource part instead city type short rather spend similar both significant stuff","979.78","30","Rather beyond share energy size play"
"55","https://placeimg.com/251/835/any","Stay soon account part wind well","Though finish star be hot often worry any include try agree out human night reflect image throughout western world area student there certainly walk","167.61","41","Open collection become light environmental deep"
"56","https://placekitten.com/143/21","Ten television model","Significant strategy medical voice boy forward science follow certainly official artist health effect forward magazine","703.15","33","Ball keep since my"
"57","https://dummyimage.com/303x144","International available despite popular stock memory","Alone popular break attention environment few voice thank local option five prove performance mention discussion","659.21","2","Sit hand society according off little happy"
"58","https://placekitten.com/749/368","During agency meet window now always","Magazine series think industry specific show pressure local rise general sort stay rise two seven lose probably up","505.98","44","Rate oil defense agree lawyer perhaps"
"59","https://placeimg.com/295/879/any","Particularly firm foreign involve","Happy far deep while movie tend those walk draw front plan focus century service nearly movie report boy","586.75","30","Reality outside painting report become market"
"60","https://www.lorempixel.com/645/42","Family event dark such","What page clear newspaper ball may read information fire purpose very them history tell boy arrive","210.33","48","Past next final tonight table loss"
"61","https://placekitten.com/186/35","Watch bed bag wind","Yes too dog among believe value fine staff that report sign office until particularly when thing everyone city contain week carry then election small certainly pattern daughter","179.71","42","Wind consider that admit Mrs look call"
"62","https://www.lorempixel.com/571/451","Bank result peace reality","Station science push industry certainly Mrs me wear prove lead professional kind wait PM every","928.32","12","Glass evening much why design"
"63","https://dummyimage.com/283x943","Hotel compare box operation prepare might","Energy safe crime social school enter wind heavy anything strategy hope return near sign Republican notice prevent figure kitchen seven write decision","267.66","25","Best I medical level"
"64","https://dummyimage.com/142x435","Allow do believe her","Man course teacher message page nearly mind perform over ten tree pull likely piece small go woman","270.88","44","Window key military deep"
"65","https://placeimg.com/565/593/any","Century law before","Scene view today father provide pass step have perform because technology important they tax machine century suddenly have quality break","422.35","20","Growth specific court yes"
"66","https://placeimg.com/317/385/any","Recently prepare scene house central baby","Choice chance of enter deep walk cause trouble movie view stuff federal like be happen unit big early amount team","896.99","37","Letter employee one reflect"
"67","https://dummyimage.com/327x1017","Class personal quickly ok road","Difficult religious push the ten will summer specific option concern black believe","817.52","29","Sister official yeah remain center without around four PM"
"68","https://dummyimage.com/294x507","Town worker present defense become","Floor themselves she inside mind without represent resource pretty write under fear knowledge player down positive tough fill happy last hit poor appear","375.0","32","Sign life successful season crime study environment style remain"
"69","https://dummyimage.com/1018x549","Machine likely middle car","Debate energy religious sport price job follow result court improve use while","163.43","15","Seven treatment kid reach government support improve"
"70","https://dummyimage.com/791x983","Black because song capital administration sound","Pm benefit arm subject over feeling money newspaper question a certain behavior send laugh cup hear prove leave national visit hundred billion","141.42","21","Fine boy sing threat bill pattern"
"71","https://dummyimage.com/910x339","Early student range","Election stop cold relate number night administration but finally piece high either himself leg organization nice happy international south open wife owner exist","673.55","20","Pick shake level season tough general simple cost"
"72","https://www.lorempixel.com/586/506","Tonight food age listen","Learn military top cup home record forward card man throughout society theory happy culture","268.42","4","Yeah process rest really wait if everything bad"
"73","https://placekitten.com/5/404","Name response garden","Large message exist word beat her include sit receive policy discussion machine hundred a itself eye magazine human station truth house try","769.33","46","Few natural fight stand one significant get interesting when"
"74","https://dummyimage.com/693x319","Assume dinner former heavy","Theory simply concern page director writer act minute treatment quickly push conference however find most city citizen to produce list run safe figure hospital","769.04","17","Set attack she represent family us lawyer"
"75","https://placekitten.com/87/187","Nature day then interest","Far around almost amount themselves test like ball cause way night somebody","101.7","45","Parent produce cut beyond"
"76","https://placekitten.com/208/283","Item boy response knowledge may thousand","Memory ball media along these easy role yes to more food recognize national training drug really check if since hair exist good","490.75","1","Ability election race decide"
"77","https://placekitten.com/257/564","Control stock same","The common prevent spend food world believe soldier certain edge couple break provide drug son","136.19","17","Newspaper allow forward hour whom inside establish"
"78","https://www.lorempixel.com/685/853","Turn another wonder reveal","Dinner write usually team remember effect unit state plant color current note order impact spend question election air","796.32","10","Commercial identify on stand trip all myself"
"79","https://placekitten.com/685/709","Law national last people","Sign admit hair look too reveal safe PM too right place TV share address","247.66","39","Including hot child investment yourself still say poor"
"80","https://www.lorempixel.com/616/378","Education red citizen notice","Economy huge miss population fly rock make build painting either return heart message matter position","659.14","12","Evening prevent image already again new weight"
"81","https://placeimg.com/716/966/any","Republican agent manage special","Season region little continue onto agent green film at best small law campaign value firm key reason choice site suddenly man remember rich yeah simple guess","670.37","16","Spend practice organization fill can cause as"
"82","https://placekitten.com/955/277","Create agree likely off anything","Few turn think tree amount billion beyond quality fill final oil Congress according senior","531.78","25","Before talk want it manage heavy"
"83","https://placekitten.com/280/952","Special seven physical court author","Fact special gas class wish relate sound market best only know fish beautiful firm evening green require bring her serve finally","2.97","12","Police college newspaper little drive require"
"84","https://dummyimage.com/949x992","To black her become","Around both place strong parent behind bank oil describe section few stay top most reflect","443.65","40","Positive idea throughout concern class"
"85","https://www.lorempixel.com/732/933","Deep minute top","Might someone young learn argue glass matter upon assume trouble key between seem building care door natural produce team operation","836.57","30","Worry there similar adult range true even matter"
"86","https://placekitten.com/769/859","Find community any","Somebody dinner former manager mind scene ago scene south ability no affect catch that area traditional property she push serve rule thus growth him power morning question","483.55","26","Hot always say notice though scene"
"87","https://placekitten.com/648/574","Child cut often can treat","Garden including form entire thank kitchen move husband friend idea thus exactly recent degree training level federal investment science task spend candidate whose","626.63","12","Person understand back use me"
"88","https://www.lorempixel.com/376/238","Clearly take product building view its","Although say bed second behind vote case none position hand benefit major friend through data difference others know expert cell style believe tough wait candidate","902.57","17","Society foot knowledge report national senior"
"89","https://placekitten.com/875/253","Activity country itself eat former","Loss manage each the arrive former within night want according speech personal task","963.87","35","Front season suddenly really social standard even exist identify"
"90","https://placekitten.com/615/674","Speak lay born","Choose song according foot choice space federal condition officer speech back ten mention laugh spring move single traditional start fund reality no work collection bar drug dark","941.58","41","Agree tax form great education"
"91","https://placeimg.com/970/30/any","See we find knowledge treatment development","Democrat wife give song computer respond current wife budget save child speech represent performance cold if project trade back control","512.61","26","Baby notice movie democratic"
"92","https://placeimg.com/326/99/any","World respond some significant specific","Degree article available possible order commercial senior current fact scientist nothing change suffer space a would free finally","717.37","50","Oil activity include audience white step"
"93","https://placeimg.com/820/17/any","Star feel chance although address","Start now family above ready lawyer attack simply protect something camera himself compare detail nature ahead American","532.33","18","Success ago five information cut"
"94","https://placeimg.com/409/692/any","Speech other question indeed message picture","Nothing defense customer family food run some Congress result every war something book notice society truth","213.73","50","Size improve hit nice kind performance sport"
"95","https://dummyimage.com/818x995","Poor modern democratic","Rock music check close agreement box people point month smile national eight she hand and democratic know party single technology similar seem operation cover program reason","352.39","31","Story around enter blue expect true discussion"
"96","https://placeimg.com/345/709/any","Could her movement edge","Theory protect movement rate effect remember memory say together bit wish purpose","463.58","11","Something expert suggest school far"
"97","https://placekitten.com/978/394","Tonight east trouble two oil drive","Environmental foreign threat billion worry less physical media artist she husband lot start find cell animal ready at order attention both hour","383.56","40","Interesting phone on far must"
"98","https://dummyimage.com/753x465","Not identify score","President board bring painting fast magazine east since use out cost game set test friend bill","413.22","38","Bill seat no type save local"
"99","https://placekitten.com/827/530","Recently value expert thing bed among","Yard tough employee situation red at stock sometimes although best various exactly several effect adult run point","463.51","46","With travel responsibility cut hour pick Mrs"
"100","https://dummyimage.com/293x189","Soldier against take budget agency","Prevent news white send guess you bar development item popular receive expert assume","361.48","40","Degree rise laugh citizen able occur quite"
"101","https://placekitten.com/463/1016","Begin should property","Not hear pressure finish pressure recognize would pattern still simply during scientist white better black over before study sound","569.44","29","How save several model think five miss camera"
